{
        "id": 5000,
        "name": "Alaska Airways",
        "country": "USA",
        "logo": "https://upload.wikimedia.org/wikipedia/en/thumb/9/9b/Alaksa_Airlines.png",
        "slogan": "Fly High",
        "head_quaters": "Alaska",
        "website": "www.alaskaairlines.com",
        "established": "1994"
    }